created_at;id_str;full_text;quote_count;reply_count;retweet_count;favorite_count;lang;user_id_str;conversation_id_str;username;tweet_url
Sun Jan 12 18:40:33 +0000 2014;422437964447510528;"Bar yang bang :p RT @ridhown: siakad unj cacat";0;0;0;0;in;440469082;422437964447510528;ardianikartika;https://twitter.com/ardianikartika/status/422437964447510528
Sun Jan 12 18:38:59 +0000 2014;422437570140590080;"Iseng buka siakad jam segini, masih aja susah. Ternyata jam segini masih banyak ank unj ngapelin siakad hoho";0;0;0;0;in;51691708;422437570140590080;krnaph;https://twitter.com/krnaph/status/422437570140590080
Sun Jan 12 18:35:26 +0000 2014;422436674157563904;"siakad unj cacat";0;1;0;0;in;254408855;422436674157563904;ridhown;https://twitter.com/ridhown/status/422436674157563904
Sun Jan 12 17:55:45 +0000 2014;422426688576684032;"Ren wakakkak ky nya ngga aktif deh itu RT @alrendy: @SiakadUNJ @dindaaws wkwkwkw ada beneran, gue kira kagaada";0;0;0;0;in;56317031;422426688576684032;dindaaws;https://twitter.com/dindaaws/status/422426688576684032
Sun Jan 12 17:00:43 +0000 2014;422412838800343040;"Jam-jam segini anak2 unj pasti lagi mantengin leptopnya., berharap siakad lancar., kalau gak bsa pasti akan di coba lagi subuh2.,";0;0;0;0;in;464207263;422412838800343040;rizalatif;https://twitter.com/rizalatif/status/422412838800343040
Sun Jan 12 15:17:42 +0000 2014;422386913039765505;"Makin gemes sama siakad unj {} :&gt ";0;0;0;0;in;278374551;422386913039765505;yunita_rh;https://twitter.com/yunita_rh/status/422386913039765505
Sun Jan 12 15:11:03 +0000 2014;422385238635851778;"Heran ya siakad unj dari tahun ke tahun gak ada benernya ckck tiap buka websitenya rasanya mulut pengen sumpah serapah aja";0;0;0;0;in;78751968;422385238635851778;ranifajrina;https://twitter.com/ranifajrina/status/422385238635851778
Sun Jan 12 13:52:16 +0000 2014;422365414337699840;"SIAKAD APAKABAR NIH??? "@MABA_UNJ: HAIII Nilai IP apakabar nihh?"";0;0;0;0;in;447949532;422365414337699840;AnggiaNoor;https://twitter.com/AnggiaNoor/status/422365414337699840
Sun Jan 12 13:40:06 +0000 2014;422362352558682114;"Blm bisa buka siakad, gmna mau tau ipk? "@MABA_UNJ: HAIII Nilai IP apakabar nihh?"";0;0;0;0;in;411294312;422362352558682114;hellwijanuar;https://twitter.com/hellwijanuar/status/422362352558682114
Sun Jan 12 13:36:45 +0000 2014;422361510564741120;"Masuk siakad aja susah min :" RT@MABA_UNJ: HAIII Nilai IP apakabar nihh?"";0;0;0;0;in;248173057;422361510564741120;kahfihernandika;https://twitter.com/kahfihernandika/status/422361510564741120
Sun Jan 12 13:33:10 +0000 2014;422360607111659520;"Siakad UNJ = wahana uji kesabaran.";0;0;1;0;in;98312182;422360607111659520;rismanrf;https://twitter.com/rismanrf/status/422360607111659520
Sun Jan 12 13:01:53 +0000 2014;422352736093351937;"Evaluasi belajar buat dosen ka "@dafidakul: Evaluasi apa de? "@MeiyanaFeehily: Blm isi evaluasi aku ka x.x "dafidakul: Duh siakad UNJ";0;0;0;0;in;284390719;422352736093351937;MeiyanaFeehily;https://twitter.com/MeiyanaFeehily/status/422352736093351937
Sun Jan 12 13:00:34 +0000 2014;422352402042220544;"Evaluasi apa de? "@MeiyanaFeehily: Blm isi evaluasi aku ka x.x "dafidakul: Duh siakad UNJ bikin patah hati aja â˜¹""";0;0;0;0;in;235057786;422352402042220544;dafidakul;https://twitter.com/dafidakul/status/422352402042220544
Sun Jan 12 13:00:00 +0000 2014;422352258504744961;"Blm isi evaluasi aku ka x.x "@dafidakul: Duh siakad UNJ bikin patah hati aja â˜¹"";0;0;0;0;in;284390719;422352258504744961;MeiyanaFeehily;https://twitter.com/MeiyanaFeehily/status/422352258504744961
Sun Jan 12 12:59:30 +0000 2014;422352133682237440;"Duh siakad UNJ bikin patah hati aja â˜¹";0;0;1;0;in;235057786;422352133682237440;dafidakul;https://twitter.com/dafidakul/status/422352133682237440
Sun Jan 12 10:51:14 +0000 2014;422319853517545474;"tutut jimbabwe RT @Ruslanhadii: Gue kira siakad kek semacam ongol ongol RT @Maharrrdhika: Garing2 cimol unj RT Ruslanhadii: Siakad itu";0;0;0;0;in;52379195;422319853517545474;Maharrrdhika;https://twitter.com/Maharrrdhika/status/422319853517545474
Sun Jan 12 10:46:10 +0000 2014;422318578235228160;"Ciye skrg jd ngurusin anak unj junior gue RT @indrafirdaus: gua gak ngerti apa maksudnya siakad ini. tp asli nyebelin abis kaga bisa dibuk";0;1;0;0;in;154154956;422318578235228160;RRPLNS;https://twitter.com/RRPLNS/status/422318578235228160
Sun Jan 12 10:43:12 +0000 2014;422317834664833025;"Gue kira siakad kek semacam ongol ongol RT @Maharrrdhika: Garing2 cimol unj RT Ruslanhadii: Siakad itu situs dimana org ingin berlomba";0;1;0;0;in;230030665;422317834664833025;Ruslanhadii;https://twitter.com/Ruslanhadii/status/422317834664833025
Sun Jan 12 10:41:36 +0000 2014;422317432879853568;"Garing2 cimol unj RT @Ruslanhadii: Siakad itu situs dimana org ingin berlomba lomba masuk kesana, sebenernya siakad isinya apaan ya? Apa ka";0;0;0;0;in;52379195;422317432879853568;Maharrrdhika;https://twitter.com/Maharrrdhika/status/422317432879853568
Sun Jan 12 09:33:31 +0000 2014;422300296170049536;"iya nih pak, kalah cepet -_- RT @Jeff_Pratama : Frustasi ya nak? Samalah kyk bapak RT @chiciiarmananda: anak UNJ = pejuang siakad (o,o)9"";0;1;0;0;in;152961785;422300064456114177;ciciarmananda;https://twitter.com/ciciarmananda/status/422300296170049536
Sun Jan 12 09:32:35 +0000 2014;422300064456114177;"Frustasi ya nak? Samalah kyk bapak RT @chiciiarmananda: anak UNJ = pejuang siakad (o,o)9"";0;1;0;0;in;100444040;422300064456114177;JefriYanu;https://twitter.com/JefriYanu/status/422300064456114177
Sun Jan 12 09:26:19 +0000 2014;422298487334502401;"Ntr juga kbocoran "@MahasiswaUNJ: Maaan! Jadwal akses siakad UNJ per-fakultas akhirnya terealisasikan. CMIIW http://t.co/BgvbSJ7tSP"";0;0;0;0;in;185953894;422298487334502401;Qome_Atuddin;https://twitter.com/Qome_Atuddin/status/422298487334502401
Sun Jan 12 09:14:10 +0000 2014;422295428994850816;"Buka siakad memang paling mudah liat di statistik UNJ :D";0;0;0;0;in;321961040;422295428994850816;RimaRahmat;https://twitter.com/RimaRahmat/status/422295428994850816
Sun Jan 12 09:08:31 +0000 2014;422294007360663552;"hufffft. semangat de!!!! RT @deoprots : RT!!!!! @chiciiarmananda: anak UNJ = pejuang siakad (o,o)9â€";0;0;0;0;in;152961785;422293296228999169;ciciarmananda;https://twitter.com/ciciarmananda/status/422294007360663552
Sun Jan 12 09:05:42 +0000 2014;422293296228999169;"anak UNJ = pejuang siakad (o,o)9";0;1;2;0;in;152961785;422293296228999169;ciciarmananda;https://twitter.com/ciciarmananda/status/422293296228999169
Sun Jan 12 07:40:32 +0000 2014;422271863826681856;"siakad unj gabisa dibuka men gimana men";0;0;0;0;in;327203934;422271863826681856;tantioongs;https://twitter.com/tantioongs/status/422271863826681856
Sun Jan 12 07:39:59 +0000 2014;422271726093733888;"@Riana_07D hahahaha itu kebiasaannya UNJ, siakad always error. makanya kalo jadi anak BEM, tuntut UNJ beli server lebih banyak lagi";0;1;0;0;in;97574177;422271339475382272;radenkikin;https://twitter.com/radenkikin/status/422271726093733888
Sun Jan 12 07:19:34 +0000 2014;422266587266027520;"FBS itu 15-17 jan dek. Ya ga bs jg la"@Pepenwouo: Bikin dosa aje tau ga buka siakad unj! Ga ngerti siapa yg geblek"";0;0;0;0;in;788562300;422266587266027520;valenmusician;https://twitter.com/valenmusician/status/422266587266027520
Sun Jan 12 07:02:09 +0000 2014;422262206617505792;"Cinta juga gi ? Haha RT @GifariNahar Network Error RT @Lia_Mayang Cinta banget sama SIAKAD UNJ! [pic] â€” http://t.co/pxBrIrQNGm";0;0;0;0;in;290397735;422262206617505792;Lia_Mayang;https://twitter.com/Lia_Mayang/status/422262206617505792
Sun Jan 12 06:09:31 +0000 2014;422248958258192385;"UNJ jga?RT @pertiwihida: @Badrinal12 klo gamau error jangan buka siakad, buka warung aje";0;0;0;0;in;395945357;422248958258192385;Badrinal12;https://twitter.com/Badrinal12/status/422248958258192385
Sun Jan 12 06:03:43 +0000 2014;422247501102448640;"Butuhnya tengah malem nek kalo jam segini siakad unj ga bisa kebuka:("@amaliapahlawati: Nih di rumah gua ada mpep :D"";0;0;0;0;in;1359127764;422247501102448640;fhanipratiwi;https://twitter.com/fhanipratiwi/status/422247501102448640
Sun Jan 12 03:53:52 +0000 2014;422214819593191424;"Dulu jamannya kuliah pasti lg mantengin laptop nungguin siakad unj";0;0;0;0;in;407484675;422214819593191424;gatsteady;https://twitter.com/gatsteady/status/422214819593191424
Sun Jan 12 03:44:27 +0000 2014;422212451690496000;"Haha sabar kal :') RT @haikalbst Wowww.. TL gue penuh dengan para mahasiswa yg merasa telah di phpin siakad .. Dear Siakad UNJ,, hemmm -,-";0;1;0;0;in;1588516627;422212451690496000;Pikachuu007;https://twitter.com/Pikachuu007/status/422212451690496000
Sun Jan 12 02:38:33 +0000 2014;422195868012273664;"Udah liat siakad din? RT @pradaumawar: Dimohon dgn sangat untuk mahasiswa unj yang non FIP jangan buka siakad dulu dong. Taatin aturan.";0;1;0;0;in;82583078;422195868012273664;m_artissy;https://twitter.com/m_artissy/status/422195868012273664
Sun Jan 12 02:31:18 +0000 2014;422194043552935936;"@HafniAlizar haha sekarang jatah fakultas lu buka siakad ya ? Susah pasti bukanya, alamat web bonto mahasiswa seabrek2, ya itu UNJ haha";0;1;0;0;in;801991279;422144515277737984;siddiqnugroho24;https://twitter.com/siddiqnugroho24/status/422194043552935936
Sun Jan 12 02:25:24 +0000 2014;422192556777013248;"RT @pradaumawar Dimohon dgn sangat untuk mahasiswa unj yang non FIP jangan buka siakad dulu dong. Taatin aturan. Mohon kerjasamanya, makasih";0;0;1;0;in;156213567;422192556777013248;dhilamenodd;https://twitter.com/dhilamenodd/status/422192556777013248
Sun Jan 12 01:59:11 +0000 2014;422185960973926400;"Apa kabar #siakadUNJ? :"";0;0;0;0;in;61983296;422185960973926400;enillesor22;https://twitter.com/enillesor22/status/422185960973926400
Sun Jan 12 01:45:32 +0000 2014;422182526753337344;"BETOOOLLLLL "@BEMUNJ_OFFICIAL: Ayo sobat UNJ buka siakad sesuai jadwal ya"";0;0;1;0;in;118549119;422182526753337344;cestannisa;https://twitter.com/cestannisa/status/422182526753337344
Sun Jan 12 01:31:12 +0000 2014;422178919945863168;"Tuh RT @BEMUNJ_OFFICIAL: Ayo sobat UNJ buka siakad sesuai jadwal ya";0;0;0;0;in;114468245;422178919945863168;adityaprtmaa;https://twitter.com/adityaprtmaa/status/422178919945863168
Sun Jan 12 01:25:49 +0000 2014;422177564225183744;"lu udah ya mar? RT @marrriikaa: Sabarrr rik! RT erixependi26: FE masih lama bgt RT BEMUNJ_OFFICIAL: Ayo sobat UNJ buka siakad sesuai jadwa";0;0;0;0;in;746848308;422177564225183744;erixependi26;https://twitter.com/erixependi26/status/422177564225183744
Sun Jan 12 01:23:16 +0000 2014;422176921208623105;"Saya lelah sama kamu 'SIAKAD UNJ' !!";0;0;1;0;in;249032798;422176921208623105;CitraTiwii;https://twitter.com/CitraTiwii/status/422176921208623105
Sun Jan 12 01:20:04 +0000 2014;422176114794954752;"Tapikan ada yang belum ini monev, dan di batesin kan tanggalnya ? "@BEMUNJ_OFFICIAL: Ayo sobat UNJ buka siakad sesuai jadwal ya"";0;0;0;0;in;231832571;422176114794954752;sihapis;https://twitter.com/sihapis/status/422176114794954752
Sun Jan 12 01:19:14 +0000 2014;422175907722174464;"FE masih lama bgt RT @BEMUNJ_OFFICIAL: Ayo sobat UNJ buka siakad sesuai jadwal ya";0;0;0;0;in;746848308;422175907722174464;erixependi26;https://twitter.com/erixependi26/status/422175907722174464
Sun Jan 12 01:18:12 +0000 2014;422175648593895424;"sebenernya FT jadwalnya kapan sih min? @BEMUNJ_OFFICIAL: Ayo sobat UNJ buka siakad sesuai jadwal ya"";0;0;0;0;in;242269351;422175648593895424;sukmaw;https://twitter.com/sukmaw/status/422175648593895424
Sun Jan 12 01:13:06 +0000 2014;422174365132673025;"RT @BEMUNJ_OFFICIAL: Ayo sobat UNJ buka siakad sesuai jadwal ya";0;0;0;0;in;96548421;422174365132673025;hrahayuningtyas;https://twitter.com/hrahayuningtyas/status/422174365132673025
Sun Jan 12 01:12:13 +0000 2014;422174140057927680;"Minta jadwalnya dong min RT @BEMUNJ_OFFICIAL: Ayo sobat UNJ buka siakad sesuai jadwal ya";0;0;0;0;in;98824675;422174140057927680;arief383;https://twitter.com/arief383/status/422174140057927680
Sun Jan 12 01:11:00 +0000 2014;422173835819896834;"Udeh min, tapi kalo log out lamaaa RT @BEMUNJ_OFFICIAL: Ayo sobat UNJ buka siakad sesuai jadwal ya";0;0;0;0;in;608547892;422173835819896834;egiewRezky;https://twitter.com/egiewRezky/status/422173835819896834
Sun Jan 12 01:08:33 +0000 2014;422173218917478401;"Ayo sobat UNJ buka siakad sesuai jadwal ya";0;0;22;0;in;250240875;422173218917478401;BEMUNJ_OFFICIAL;https://twitter.com/BEMUNJ_OFFICIAL/status/422173218917478401
Sun Jan 12 00:40:42 +0000 2014;422166211690905600;"Network Error RT @Lia_Mayang Cinta banget sama SIAKAD UNJ! [pic] â€” https://t.co/TcGjKp6jDN";0;1;0;0;in;240596466;422166211690905600;GifariNahar;https://twitter.com/GifariNahar/status/422166211690905600
Sun Jan 12 00:24:27 +0000 2014;422162119014891520;"Cinta banget sama SIAKAD UNJ! [pic] â€” https://t.co/nUtN8bDxBY";0;0;1;1;in;290397735;422162119014891520;Lia_Mayang;https://twitter.com/Lia_Mayang/status/422162119014891520
Sat Jan 11 23:49:15 +0000 2014;422153263148838912;"ahahhaha kocak lo pal :D gara2 siakad jdi bgni RT@palupiipasta jin : ku berikan satu permintaan anak unj : pengen siakad selancar twitter wk";0;1;0;0;in;1623194065;422152737972060160;NopihNurvriyani;https://twitter.com/NopihNurvriyani/status/422153263148838912
Sat Jan 11 23:47:53 +0000 2014;422152918947471361;"Pasrah ÂªjÂª insyi ÅœÃ£â™Î¬Ì²Ì£Ì¥  â€‹Ø§ÙŽÙ„Ù„Ù‘Ù‡Ù,hahaha :D"@IKNisaa: kayaknya siakad unj mau dibagi per kelas pun akan tetep kaya gini deh -__-"";0;0;0;0;in;1903662648;422152918947471361;trianisiti;https://twitter.com/trianisiti/status/422152918947471361
Sat Jan 11 23:47:10 +0000 2014;422152737972060160;"jin : ku berikan satu permintaan anak unj : pengen siakad selancar twitter wkwkw";0;2;1;0;in;277328278;422152737972060160;palupiipasta;https://twitter.com/palupiipasta/status/422152737972060160
Sat Jan 11 23:09:35 +0000 2014;422143278058721281;"Haha unj gini nil:D "@doankdaniel: Digalauin siakad haha "sulas_M: Nyerah deh yaa, besok aja dicoba lagi-_-""";0;0;0;0;in;254850159;422143278058721281;sulas_M;https://twitter.com/sulas_M/status/422143278058721281
Sat Jan 11 23:07:25 +0000 2014;422142733336076288;"Udah tw kelakuan siakad. sabar aj buat yg baru masuk unj . besyukur skrg udh dibagi per fakultas, Tpi yakin regulasi gitu juga masih Tetot";0;0;0;0;in;529249930;422142733336076288;kancingseragam;https://twitter.com/kancingseragam/status/422142733336076288
Sat Jan 11 21:07:32 +0000 2014;422112565838090240;"Lucuk yee jam segini aja msh eror. Emg cuma siakad unj yg setiap smstr bikin naik daraah :'''))))";0;2;0;0;in;150190777;422112565838090240;lindadianp;https://twitter.com/lindadianp/status/422112565838090240
Sat Jan 11 20:29:11 +0000 2014;422102913024937984;"Gue udah bela-belain bangun jam 3, tetep "fatal error". ampas emang dah siakad unj. Pengen liat IP aja susah";0;1;0;0;in;262653547;422102913024937984;mkhubaib;https://twitter.com/mkhubaib/status/422102913024937984
Sat Jan 11 20:15:59 +0000 2014;422099589748244480;"@magnaemarisya haha unj berguncang ya ne ? :D apa nae? siakad kah ?";0;1;0;0;in;79384606;422098809196249089;PutriHumairoh;https://twitter.com/PutriHumairoh/status/422099589748244480
Sat Jan 11 20:10:08 +0000 2014;422098119040311296;"cuman siakad unj doang yg slalu rutin tiap semester slalu menguji kesabaran mahasiswa nya";0;1;0;0;in;172553686;422098119040311296;esterlely;https://twitter.com/esterlely/status/422098119040311296
Sat Jan 11 19:56:26 +0000 2014;422094670026387456;"Sakin stress nya , gua searching aja siakad unj di playstore eh gak ada -_-";0;0;0;0;in;172553686;422094670026387456;esterlely;https://twitter.com/esterlely/status/422094670026387456
Sat Jan 11 19:52:33 +0000 2014;422093692456161280;"jam segini banyak banget anak unj yg ol, pasti pada penasaran buka siakad  -)";0;0;0;0;in;111563842;422093692456161280;aryoluhur;https://twitter.com/aryoluhur/status/422093692456161280
Sat Jan 11 19:29:03 +0000 2014;422087780596858880;"Mentang Goreng! RT @rispipi: Mentang-mentang dah haha RT @RiswanMarbun: masih aja berharap sama Siakad UNJ, move on lah ~";0;0;0;0;in;76047228;422087780596858880;RiswanMarbun;https://twitter.com/RiswanMarbun/status/422087780596858880
Sat Jan 11 19:16:49 +0000 2014;422084703298940928;"Pada saat-saat ini mahasiswa UNJ sedang sibuk-sibuknya ingin melihat nilai tapi mengapa SIAKAD nya susah banget diakses. :|";0;0;0;0;in;276359944;422084703298940928;dokoculay_;https://twitter.com/dokoculay_/status/422084703298940928
Sat Jan 11 19:12:06 +0000 2014;422083513836244992;"Mentang-mentang dah haha RT @RiswanMarbun: masih aja berharap sama Siakad UNJ, move on lah ~";0;0;0;0;in;71976394;422083513836244992;_rispi;https://twitter.com/_rispi/status/422083513836244992
Sat Jan 11 19:10:09 +0000 2014;422083021991186432;"Gembel syi wkwk RT @IKNisaa: kayaknya siakad unj mau dibagi per kelas pun akan tetep kaya gini deh -__-";0;0;1;0;in;1719855715;422083021991186432;sariamallia2;https://twitter.com/sariamallia2/status/422083021991186432
Sat Jan 11 19:07:01 +0000 2014;422082234531602432;"masih aja berharap sama Siakad UNJ, move on lah ~";0;0;0;0;in;76047228;422082234531602432;RiswanMarbun;https://twitter.com/RiswanMarbun/status/422082234531602432
Sat Jan 11 18:32:21 +0000 2014;422073511939547136;"Kayaknya cuma UNJ yang mau liat IP susah bener dr zaman gue dede2 maba sampe mahasiswa tingkat akhir. Siakad ga ada kemajuan. Zzz";0;1;0;0;in;480847611;422073511939547136;baenantha;https://twitter.com/baenantha/status/422073511939547136
Sat Jan 11 18:10:51 +0000 2014;422068100171722752;"Gue bukan anak unj tapi gue tau sulitnya akses siakad wkwkwk";0;0;0;0;in;87163849;422068100171722752;tamirizt;https://twitter.com/tamirizt/status/422068100171722752
Sat Jan 11 17:38:55 +0000 2014;422060066003353601;"Woi anak UNJ pada tidur kek. Biar gue doang yg buka siakad.";0;0;0;0;in;241749682;422060066003353601;risnaaat;https://twitter.com/risnaaat/status/422060066003353601
Sat Jan 11 17:29:46 +0000 2014;422057762080559104;"Sombong~ RT @inggidn: Selamatidur para pejuang siakad unj:')";0;0;0;0;in;347202277;422057762080559104;novitautari_;https://twitter.com/novitautari_/status/422057762080559104
Sat Jan 11 17:15:57 +0000 2014;422054282666733568;"ada berapa ratus juta ya mahasiswa unj, sampe sampe siakad jam segini masih penuh ae";0;0;0;0;in;449757698;422054282666733568;suryadinsanusi;https://twitter.com/suryadinsanusi/status/422054282666733568
Sat Jan 11 17:13:18 +0000 2014;422053617957236736;"Salah satu contoh kekeluhan anak unj di liburan semester &gt &gt &gt  RT @alinot: Siakad kok kamu gamau dibuka sih........ ayodong";0;1;0;0;in;263626160;422053617957236736;dikiin;https://twitter.com/dikiin/status/422053617957236736
Sat Jan 11 16:39:31 +0000 2014;422045117252255744;"Lagi masuk rumah sakit pay, dia tekanan batin, di omongin mulu sama penghuni UNJ, RT @sarahsnf: siakad apakabar??";0;0;0;0;in;230030665;422045117252255744;Ruslanhadii;https://twitter.com/Ruslanhadii/status/422045117252255744
Sat Jan 11 16:34:27 +0000 2014;422043840850046977;"Oke otw ke N demi siakad, rame deh UNJ gini hari RT @iimuutiiaa: @febryhadiyana cobaaa yang di N gih trusss kalau gk bisa juga yg di TMII";0;0;0;0;in;238123242;422043840850046977;febryhadiyana;https://twitter.com/febryhadiyana/status/422043840850046977
Sat Jan 11 16:30:51 +0000 2014;422042933685395456;"Bahasa dan Seni min ._. RT @MahasiswaUNJ: Maaan! Jadwal akses siakad UNJ per-fakultas akhirnya terealisasikan. CMIIW http://t.co/WNGd70OlpT";0;0;1;0;in;247643601;422042933685395456;hanysniha;https://twitter.com/hanysniha/status/422042933685395456
Sat Jan 11 15:50:48 +0000 2014;422032853916864512;"Wah tmn sy tuh pak "@bambu_segara: Kata si @tarmujisch @fajrikurniaone:lebih mudah menklukkan hati cewek(sifida)dripd menaklukkan SIAKAD UNJ";0;1;0;0;in;133210514;422032853916864512;ifatifatonah;https://twitter.com/ifatifatonah/status/422032853916864512
Sat Jan 11 15:34:13 +0000 2014;422028684531613696;"Sekedar mengingatkan aja buat warga UNJ~ (Jadwal Akses SIAKAD) http://t.co/2wXydYrvTM";0;0;0;0;in;313861630;422028684531613696;virainsani;https://twitter.com/virainsani/status/422028684531613696
Sat Jan 11 15:29:55 +0000 2014;422027598684635136;"Pukpuk RT @fahrizalH: Sejak kapan UNJ ada liburan . Jelas" setiap liburan mahasiswanya kebayang siakad yang gak bisa di buka .";0;0;0;0;in;777664622;422027598684635136;WahyudiS04;https://twitter.com/WahyudiS04/status/422027598684635136
Sat Jan 11 15:28:21 +0000 2014;422027207020535809;"Sejak kapan UNJ ada liburan . Jelas" setiap liburan mahasiswanya kebayang siakad yang gak bisa di buka .";0;0;0;0;in;49880967;422027207020535809;fahrizalH;https://twitter.com/fahrizalH/status/422027207020535809
Sat Jan 11 15:11:09 +0000 2014;422022878763028480;"#InfoJurusan WAJIB u/ TPers angk. 2012 &amp  2013 untuk mengisi Evaluasi Dosen di Siakad UNJ sampai tanggal 15 Januari 2014 :))";0;0;1;0;in;531409087;422022878763028480;hmptpunj;https://twitter.com/hmptpunj/status/422022878763028480
Sat Jan 11 14:02:18 +0000 2014;422005550201589760;""Kata si Jay @tarmujisch @fajrikurniaone : lebih mudah menaklukkan hati cewek (sifida) daripada menaklukkan SIAKAD UNJ"";0;1;1;0;in;1622920650;422005550201589760;bambu_segara;https://twitter.com/bambu_segara/status/422005550201589760
Sat Jan 11 13:55:58 +0000 2014;422003958912020480;"Banget yan, sampe skrg gils wkwk RT @radenrawayan: Bala ye RT @michozelrado: Penyakit unj nih, siakad-_-";0;0;0;0;in;149080687;421889371734683648;michozelrado;https://twitter.com/michozelrado/status/422003958912020480
Sat Jan 11 12:49:24 +0000 2014;421987206538858496;"@barrinnoize iya bang malmingan sama siakad unj wk";0;1;0;0;in;93385220;421985076579430400;zelmon;https://twitter.com/zelmon/status/421987206538858496
Sat Jan 11 12:14:30 +0000 2014;421978422240620544;"[INFO] Masa pengisian nilai oleh dosen pada 30 Desember 2013 -10 Januari 2014 dan untuk sementara mahasiswa tidak dapat membuka siakad.";0;0;0;0;in;532760825;421978422240620544;speducation_UNJ;https://twitter.com/speducation_UNJ/status/421978422240620544
Sat Jan 11 12:11:03 +0000 2014;421977555663872000;"Selamat malam :) diinformasikan bhwa bsk adalah jadwal teman2 FIP mengakses siakad. Bagi yg lupa pasword dpt mengurusnya di fakultas masing2";0;0;3;0;in;532760825;421977555663872000;speducation_UNJ;https://twitter.com/speducation_UNJ/status/421977555663872000
Sat Jan 11 10:49:03 +0000 2014;421956919054442496;"RT @zehaini: Jadwal SIAKAD UNJ (3~099~2014) http://t.co/J6AlpunDeV";0;0;0;0;in;1307318551;421956919054442496;JiaiB2012;https://twitter.com/JiaiB2012/status/421956919054442496
Sat Jan 11 10:47:31 +0000 2014;421956531462995969;"2. Masa pengisian nilai oleh dosen pada 30 Desember 2013 - 10 Januari 2014 dan untuk sementara mahasiswa tidak dapat membuka siakad.";0;0;1;0;in;249668145;421956531462995969;Sasing_UNJ;https://twitter.com/Sasing_UNJ/status/421956531462995969
Sat Jan 11 10:46:48 +0000 2014;421956351879696385;"#INFO Hasil kunjungan ke Pustikom: 1. Mahasiswa yang lupa password siakad dapat mengurusnya di fakultas masing-masing.";0;0;1;0;in;249668145;421956351879696385;Sasing_UNJ;https://twitter.com/Sasing_UNJ/status/421956351879696385
Sat Jan 11 08:21:27 +0000 2014;421919773094445056;"Pada sabaarrr yaaa , siakad nya lemot huhu";0;0;0;0;in;1593356772;421919773094445056;FDesign_UNJ;https://twitter.com/FDesign_UNJ/status/421919773094445056
Sat Jan 11 08:21:13 +0000 2014;421919714890096641;"Nahhh , pasti masih pada penasaran sama siakad kaaannn , mimin juga sih, baru bisa buka stlah berjamjam pantengin laptop :')";0;0;0;0;in;1593356772;421919714890096641;FDesign_UNJ;https://twitter.com/FDesign_UNJ/status/421919714890096641
Sat Jan 11 08:19:41 +0000 2014;421919326837669888;"haha kasianamat, lu udah liat nilai lu kal?RT @haikalbst: Karena aku sedang dibully oleh seluruh mahasiswa UNJ RT "iie_lyanti: siakad oh sia";0;1;0;0;in;239648560;421919326837669888;iie_lyanti;https://twitter.com/iie_lyanti/status/421919326837669888
Sat Jan 11 07:05:46 +0000 2014;421900724981612544;"Siiip "@BEMJBJ_UNJ: Nilai sudah keluar di Siakad lho. Buka sesuai jadwal ya biar ngga ada gangguan  ) dan semoga hasilnya memuaskan! :D"";0;0;0;0;in;146833195;421900724981612544;aji_kk;https://twitter.com/aji_kk/status/421900724981612544
Sat Jan 11 07:04:35 +0000 2014;421900428897300480;"Nilai sudah keluar di Siakad lho. Buka sesuai jadwal ya biar ngga ada gangguan  ) dan semoga hasilnya memuaskan! :D";0;0;0;0;in;265098737;421900428897300480;BEMJBJ_UNJ;https://twitter.com/BEMJBJ_UNJ/status/421900428897300480
Sat Jan 11 05:07:48 +0000 2014;421871040742973440;"Jadwal SIAKAD UNJ (3~099~2014) http://t.co/kCOowBqfdP";0;0;0;0;in;1429309578;421871040742973440;zehaini;https://twitter.com/zehaini/status/421871040742973440
Sat Jan 11 04:49:46 +0000 2014;421866499460968449;"Hey Masiwa unj selamaat berjuang membuka siakad yang supersuper juara!";0;1;0;0;in;138308361;421866499460968449;muteRasyid;https://twitter.com/muteRasyid/status/421866499460968449
Sat Jan 11 04:34:20 +0000 2014;421862616735039489;""@fidensiusnivo: Penting! @HMJ_TP_UNJ bg TPers 2012 &amp  2013, jgn lupa utk mengisi evaluasi dosen di siakad pling lmbat tgl 18 Januari 2014.."";0;0;0;0;in;531409087;421862616735039489;hmptpunj;https://twitter.com/hmptpunj/status/421862616735039489
Sat Jan 11 04:18:50 +0000 2014;421858717198336000;"@franciscuspanda iyalah. siakad kn lg diakses mahasiswa se unj u.u gue blm liat ._.";0;1;0;0;in;83821607;421854889879543808;kimelamel;https://twitter.com/kimelamel/status/421858717198336000
Sat Jan 11 04:10:21 +0000 2014;421856580707950592;""@MahasiswaUNJ: HOT @infoUNJ : 29 Januari 2014 Batas Penalti persetujuan KRS oleh admin siakad. #UNJ"";0;0;0;0;in;462969902;421856580707950592;Egi_Rizkiyarno;https://twitter.com/Egi_Rizkiyarno/status/421856580707950592
Sat Jan 11 04:10:14 +0000 2014;421856551444291585;""@MahasiswaUNJ: HOT @infoUNJ : 13 - 26 Januari 2014 Pengisian KRS di siakad. #UNJ"";0;0;0;0;in;462969902;421856551444291585;Egi_Rizkiyarno;https://twitter.com/Egi_Rizkiyarno/status/421856551444291585
