created_at;id_str;full_text;quote_count;reply_count;retweet_count;favorite_count;lang;user_id_str;conversation_id_str;username;tweet_url
Wed Jan 15 14:59:08 +0000 2014;423469406488756224;"Haha! RT @MahasiswaUNJ: Ratusan Mahasiswa UNJ selalu mendadak Mario-Teguh-able sesaat sesudah mengecek IP Siakad.";0;0;0;0;in;47044750;423469406488756224;dinndamalia;https://twitter.com/dinndamalia/status/423469406488756224
Wed Jan 15 14:52:55 +0000 2014;423467842160189440;"Sudah ada yang buka siakad? Bagaimana KHS semester 099nya? Semoga tetap memuaskan yah :)";0;0;0;0;in;2221210682;423467842160189440;PIKATENNA_UNJ;https://twitter.com/PIKATENNA_UNJ/status/423467842160189440
Wed Jan 15 14:48:22 +0000 2014;423466695387144192;"Bukannya siakang yg udah nunggu di kua? RT "@raracumii: yang bikin pengen cepet2 lulus dari UNJ adalah siakad ini eerrww --""";0;0;0;0;in;93826068;423466695387144192;dmcahaya;https://twitter.com/dmcahaya/status/423466695387144192
Wed Jan 15 14:33:09 +0000 2014;423462866440560640;"yang bikin pengen cepet2 lulus dari UNJ adalah siakad ini eerrww --"";0;0;0;0;in;66277923;423462866440560640;mrsmyway08;https://twitter.com/mrsmyway08/status/423462866440560640
Wed Jan 15 14:04:28 +0000 2014;423455647322345472;"Ada yang udh sukses buka SIAKAD, dan ada juga yg masih berusaha membukanya. Ya seimbang lah persentasenya :D #semangatkawan";0;0;0;0;in;616136463;423455647322345472;bemppbsi_unj;https://twitter.com/bemppbsi_unj/status/423455647322345472
Wed Jan 15 13:55:53 +0000 2014;423453486525992960;"dimakan deh buah delimanya biar ga galau :)RT @Nezsacca: Masih delima :')RTHumas_BEMJBSI: Gimana ni kalian masih pada dilema dengan SIAKAD?";0;0;0;0;in;616136463;423453486525992960;bemppbsi_unj;https://twitter.com/bemppbsi_unj/status/423453486525992960
Wed Jan 15 13:55:14 +0000 2014;423453322818125825;"wow selamat ya :DRT @hidyanuralfi: Alhamdulillah sudah kakak xD "Humas_BEMJBSI: Gimana ni kalian masih pada dilema dengan SIAKAD? Atau sudah";0;0;1;0;in;616136463;423453322818125825;bemppbsi_unj;https://twitter.com/bemppbsi_unj/status/423453322818125825
Wed Jan 15 13:54:49 +0000 2014;423453218660970496;"wah, sabar ya mas, terus usaha aminRT @fajrin_stian: masih miris min :("Humas_BEMJBSI Gimana ni kalian masih pada dilema dengan SIAKAD? Atau";0;0;0;0;in;616136463;423453218660970496;bemppbsi_unj;https://twitter.com/bemppbsi_unj/status/423453218660970496
Wed Jan 15 13:54:07 +0000 2014;423453044031115264;"Selamat istirahat dan liburan kakaRT @janahbgt: sudah tenangg :) RT Humas_BEMJBSI Gimana ni kalian masih pada dilema dengan SIAKAD? Atau sud";0;1;0;0;in;616136463;423453044031115264;bemppbsi_unj;https://twitter.com/bemppbsi_unj/status/423453044031115264
Wed Jan 15 13:47:32 +0000 2014;423451384797999104;"Gimana ni kalian masih pada dilema dengan SIAKAD? Atau sudah tenang, karena sudah bisa menembusnya?";0;1;0;0;in;616136463;423451384797999104;bemppbsi_unj;https://twitter.com/bemppbsi_unj/status/423451384797999104
Wed Jan 15 13:18:34 +0000 2014;423444098284912640;"RT @MahasiswaUNJ Ratusan Mahasiswa UNJ selalu mendadak Mario-Teguh-able sesaat sesudah mengecek IP Siakad.";0;0;0;0;in;123147651;423444098284912640;santikaaR;https://twitter.com/santikaaR/status/423444098284912640
Wed Jan 15 13:05:51 +0000 2014;423440897242460160;"siakad unj lemot -__- kapan gue liat nilai nya";0;0;0;0;in;849127808;423440897242460160;FachryZone;https://twitter.com/FachryZone/status/423440897242460160
Wed Jan 15 12:38:36 +0000 2014;423434038758481920;"Hahaha "@MahasiswaUNJ: Ratusan Mahasiswa UNJ selalu mendadak Mario-Teguh-able sesaat sesudah mengecek IP Siakad."";0;0;0;0;in;44840671;423434038758481920;aisyahneha;https://twitter.com/aisyahneha/status/423434038758481920
Wed Jan 15 12:22:18 +0000 2014;423429936012353536;"penalti KRS di Siakad 29jan pencetakan daftar kls 30-31jan perkuliahan 3feb-23mei  #share";0;0;3;0;in;616136463;423429936012353536;bemppbsi_unj;https://twitter.com/bemppbsi_unj/status/423429936012353536
Wed Jan 15 12:14:23 +0000 2014;423427943243980801;"2.Masa pengisian nilai oleh dosen pada 30 Desember 2013 -10 Januari 2014 dan untuk sementara mahasiswa tidak dapat membuka siakad.";0;0;0;0;in;616136463;423427943243980801;bemppbsi_unj;https://twitter.com/bemppbsi_unj/status/423427943243980801
Wed Jan 15 12:13:18 +0000 2014;423427672031911936;"Berikut adalah jadwal akses siakad di mulai setiap pukul 06.00-18.00 WIB, selain di waktu tersebut, akses siakad bebas (tidak terjadwal):";0;0;0;0;in;616136463;423427672031911936;bemppbsi_unj;https://twitter.com/bemppbsi_unj/status/423427672031911936
Wed Jan 15 12:09:18 +0000 2014;423426666354835456;"@dithaprastiana wkwk RT @MahasiswaUNJ: Ratusan Mahasiswa UNJ selalu mendadak Mario-Teguh-able sesaat sesudah mengecek IP Siakad.";0;1;0;0;in;218041311;423426666354835456;fitripi;https://twitter.com/fitripi/status/423426666354835456
Wed Jan 15 11:50:21 +0000 2014;423421896885932032;"Bah! Wkwk "@MahasiswaUNJ: Ratusan Mahasiswa UNJ selalu mendadak Mario-Teguh-able sesaat sesudah mengecek IP Siakad."";0;0;0;0;in;279977994;423421896885932032;srrachmawatii;https://twitter.com/srrachmawatii/status/423421896885932032
Wed Jan 15 11:37:08 +0000 2014;423418568558923776;"Whahaha termasuk elo jangs?? "@MahasiswaUNJ: Ratusan Mahasiswa UNJ selalu mendadak Mario-Teguh-able sesaat sesudah mengecek IP Siakad."";0;0;0;0;in;101417160;423418568558923776;mentarigum;https://twitter.com/mentarigum/status/423418568558923776
Wed Jan 15 11:28:54 +0000 2014;423416498859016192;"gw blm bisa kebuka. Ih! RT @MahasiswaUNJ: Ratusan Mahasiswa UNJ selalu mendadak Mario-Teguh-able sesaat sesudah mengecek IP Siakad.";0;0;0;0;in;112342980;423416498859016192;asnianoy;https://twitter.com/asnianoy/status/423416498859016192
Wed Jan 15 11:35:43 +0000 2014;423418214760984576;"Iya! Sok, sebel.. "@MahasiswaUNJ: Ratusan Mahasiswa UNJ selalu mendadak Mario-Teguh-able sesaat sesudah mengecek IP Siakad."";0;0;0;0;in;101738255;423418214760984576;nyinyiss;https://twitter.com/nyinyiss/status/423418214760984576
Wed Jan 15 11:27:02 +0000 2014;423416027922178048;"(._.)/| RT @MahasiswaUNJ: Ratusan Mahasiswa UNJ selalu mendadak Mario-Teguh-able sesaat sesudah mengecek IP Siakad.";0;0;0;0;in;1307318551;423416027922178048;JiaiB2012;https://twitter.com/JiaiB2012/status/423416027922178048
Wed Jan 15 11:26:22 +0000 2014;423415860678512641;"Begitu juga gue min RT"@MahasiswaUNJ: Ratusan Mahasiswa UNJ selalu mendadak Mario-Teguh-able sesaat sesudah mengecek IP Siakad."";0;0;0;0;in;1960150430;423415860678512641;kaptenkuas;https://twitter.com/kaptenkuas/status/423415860678512641
Wed Jan 15 09:19:13 +0000 2014;423383863109619712;"sukses ya IP-nyaRT @DianaIJI: mantap min RT Humas_BEMJBSI: Lagi pada liburan ya? Eits gimana hasil IP-nya? Atau masih pada nge-galauin SIAKA";0;0;0;0;in;616136463;423383863109619712;bemppbsi_unj;https://twitter.com/bemppbsi_unj/status/423383863109619712
Wed Jan 15 09:14:27 +0000 2014;423382660766261248;"Lagi pada liburan ya? Eits gimana hasil IP-nya? Atau masih pada nge-galauin SIAKAD? #sharingdong";0;0;0;0;in;616136463;423382660766261248;bemppbsi_unj;https://twitter.com/bemppbsi_unj/status/423382660766261248
Wed Jan 15 07:36:56 +0000 2014;423358121642172416;"Padahal udah militan bgt.. mantengin siakad dr jam 1 pagi sampe sekarang.. tapi dia masih sulit di taklukan *Tradisi anak UNJ tiap tahun";0;0;0;0;in;719653094;423358121642172416;hildadiana1;https://twitter.com/hildadiana1/status/423358121642172416
Wed Jan 15 07:22:12 +0000 2014;423354414871871488;"ga 2 jam juga :D haha RT @fajrinanabila: Smpe 2 jam setia, yg muncul fatal error deui :D "Ribhantoe: Kapan yaa SIAKAD UNJ anti fatal error?"";0;0;0;0;in;360420922;423354414871871488;Ribhantoe;https://twitter.com/Ribhantoe/status/423354414871871488
Wed Jan 15 06:30:47 +0000 2014;423341473526853632;"Saat gak ada lagi orang yg mau jadi mahasiswa unj RT @Ribhantoe: Kapan yaa SIAKAD UNJ anti fatal error?";0;0;1;0;in;91052781;423340934412402688;Hani_Zakiya;https://twitter.com/Hani_Zakiya/status/423341473526853632
Wed Jan 15 06:28:38 +0000 2014;423340934412402688;"Kapan yaa SIAKAD UNJ anti fatal error?";0;1;0;0;in;360420922;423340934412402688;Ribhantoe;https://twitter.com/Ribhantoe/status/423340934412402688
Wed Jan 15 05:53:38 +0000 2014;423332126834966528;"Lo liat nya dr siakad atau dr Unj nya nev? "@dersanalaneva: Baru kali ini nilai gue hampir semuanya B. Wkwk parah turun drastis."";0;0;0;0;in;1032367200;423332126834966528;jaojahss;https://twitter.com/jaojahss/status/423332126834966528
Wed Jan 15 05:42:05 +0000 2014;423329219100151808;"siakad unj gila kaliye hhh";0;0;0;0;in;164202930;423329219100151808;ririribek;https://twitter.com/ririribek/status/423329219100151808
Wed Jan 15 04:44:53 +0000 2014;423314824626327552;"yg masih berjuang dgn SIAKAD. semangatt... smg nilai.a sesuai harapan ya  ^_^ ksuksesan ssorang tdk selama.a krn nilai ko #goMuktamarFSI-KU";0;0;0;0;in;608495030;423314824626327552;FSIKU_UNJ;https://twitter.com/FSIKU_UNJ/status/423314824626327552
Wed Jan 15 04:36:11 +0000 2014;423312632607567872;"titip kek min Ë˜â€¢Ë˜ RT @CivicEducationA: woy ke unj sini, lancar bgt siakad. ditunggu di lobby. ngebut bener anti fatal eror";0;1;0;0;in;585413251;423312632607567872;kdpratiwi;https://twitter.com/kdpratiwi/status/423312632607567872
Wed Jan 15 04:32:35 +0000 2014;423311726797262848;"woy ke unj sini, lancar bgt siakad. ditunggu di lobby. ngebut bener anti fatal eror";0;0;0;0;in;2273239026;423311726797262848;CivicEducationA;https://twitter.com/CivicEducationA/status/423311726797262848
Wed Jan 15 04:30:21 +0000 2014;423311164810866688;"@ridwanbalaa Wan lo nyoba buka siakad pake anjungan atau buka pake wifi UNJ yang portal akademika? Ada kejadian apa di nilai?";0;1;1;0;in;45110881;423311164810866688;ddlerman;https://twitter.com/ddlerman/status/423311164810866688
Wed Jan 15 03:59:15 +0000 2014;423303339070074880;"@alinot @nurilim mungkin dikarenakan perbedaan waktu dari jam siakad dengan jam yg kita gunakan";0;0;0;0;in;597992923;423013170072920064;Tpm_Unj;https://twitter.com/Tpm_Unj/status/423303339070074880
Wed Jan 15 03:28:40 +0000 2014;423295645407928320;"never ending battle: mahasiswi/a unj vs. siakad unj. semangaaaat!!!";0;0;0;0;in;39544920;423295645407928320;aelisangela;https://twitter.com/aelisangela/status/423295645407928320
Wed Jan 15 03:34:27 +0000 2014;423297099849945088;"Wahahahahaha "@aelisangela: never ending battle: mahasiswi/a unj vs. siakad unj. semangaaaat!!!"";0;0;0;0;in;184684133;423297099849945088;hanamagdaln;https://twitter.com/hanamagdaln/status/423297099849945088
Wed Jan 15 03:38:52 +0000 2014;423298209029423104;"Buat halimuners yg mau buka siakad dg akses yg lbh cepat, Bisa lewat komputer TU atau wifi UNJ, dengan alamat 192.168.4.135 :)";0;0;9;3;in;424174139;423298209029423104;Bemfppsiunj;https://twitter.com/Bemfppsiunj/status/423298209029423104
Wed Jan 15 02:37:50 +0000 2014;423282852159950849;"HAHA RT @diki_ilmahaq kampret siakad UNY aja cepet banget, masa UNJ macet ,mentang2 di jakarta";0;0;0;0;in;260173839;423282129867268097;RNtans;https://twitter.com/RNtans/status/423282852159950849
Wed Jan 15 02:36:24 +0000 2014;423282490061496320;"Belum bayaran kali lu"@diki_ilmahaq: kampret siakad UNY aja cepet banget, masa UNJ macet ,mentang2 di jakarta"";0;1;0;0;in;215240005;423282490061496320;masbayyyu;https://twitter.com/masbayyyu/status/423282490061496320
Wed Jan 15 02:34:58 +0000 2014;423282129867268097;"kampret siakad UNY aja cepet banget, masa UNJ macet ,mentang2 di jakarta";0;1;0;0;in;236334817;423282129867268097;diki_ilmahaq;https://twitter.com/diki_ilmahaq/status/423282129867268097
Wed Jan 15 02:01:25 +0000 2014;423273686339039232;"Haha iya amiin :) tiati kalo masuk unj tar dibunuh loh ama siakad *loh "@nuruuulfadillah: Aminnn semoga jadi guru wkwkwk "@nisahh_12: 5 bu";0;0;1;0;in;225478653;423273686339039232;nisahh_12;https://twitter.com/nisahh_12/status/423273686339039232
Wed Jan 15 01:52:04 +0000 2014;423271333355483136;"@nadyaevalina @asma_SN12 oh gituu :( taampun siakad unj :"(";0;1;0;0;in;225282483;423270026934628352;ShaviraAmalia;https://twitter.com/ShaviraAmalia/status/423271333355483136
Wed Jan 15 01:21:56 +0000 2014;423263749915426816;"saya kira siakad UNJ sudah makin canggih. ternyata dari awal saya masuk kuliah sampai setahun saya lulus masih saja susah akses.";0;0;0;0;in;218117642;423263749915426816;dhezun;https://twitter.com/dhezun/status/423263749915426816
Wed Jan 15 00:58:01 +0000 2014;423257733010182144;"sampe kapan siakad do unj dot ac do ai di nya network eror haaaah?!?!?!?! :'(";0;0;0;0;in;85999322;423257733010182144;dendykembarrr;https://twitter.com/dendykembarrr/status/423257733010182144
Wed Jan 15 00:57:29 +0000 2014;423257597429284864;"Iyaa ka, padahala sudah bukanya ikuti jadwal , tapi ya begini keadaannya :( RT @313kamil: @anitaputria siakad unj melatih kesabaran..";0;1;0;0;in;240898968;423257597429284864;anitaputria;https://twitter.com/anitaputria/status/423257597429284864
Tue Jan 14 23:53:39 +0000 2014;423241531433029633;"Cie, korban siakad, sama dong kya gw, hahaha @saleemeka: udah biasa di php in sm diakad UNJ mah :D u d a h b i a s a a a a a a";0;0;0;0;in;483673311;423241531433029633;dwitaaprilya;https://twitter.com/dwitaaprilya/status/423241531433029633
Tue Jan 14 23:22:00 +0000 2014;423233566160343040;""Bisa ma ? @asma_SN12: :' RT @nisahh_12: asma_SN12 pftt tiap semester dibikin galau mulu heran #siakadunj"";0;1;0;0;in;225478653;423233566160343040;nisahh_12;https://twitter.com/nisahh_12/status/423233566160343040
Tue Jan 14 23:17:33 +0000 2014;423232448416075776;"Jangan sampe gue beralih cita cita jadi rektor unj nih biar bisa benerin pustikom dan seisi isinya terutama si siakad";0;0;0;0;in;237541917;423232448416075776;saptisapti;https://twitter.com/saptisapti/status/423232448416075776
Tue Jan 14 23:16:47 +0000 2014;423232256262422528;"Seketemunya gue abis dr bni k apres "@novaaaaw: @saptisapti siakad unj gak bisa dibanggakan:( lu brkt jamber? Pd janjian jamber sih anak2 ep";0;0;0;0;in;237541917;423232256262422528;saptisapti;https://twitter.com/saptisapti/status/423232256262422528
Tue Jan 14 23:05:44 +0000 2014;423229474528694272;"Â« Sedang berusaha membuka siakad unj yang terlalu menyebalkan";0;0;0;0;in;317556204;423229474528694272;putrii_elma;https://twitter.com/putrii_elma/status/423229474528694272
Tue Jan 14 22:41:18 +0000 2014;423223325855195136;":' RT @nisahh_12: asma_SN12 pftt tiap semester dibikin galau mulu heran #siakadunj";0;0;0;0;in;283360146;423223325855195136;asma_SN12;https://twitter.com/asma_SN12/status/423223325855195136
Tue Jan 14 22:32:49 +0000 2014;423221189427732480;"Temen gua anak Unsoed cepet bener login SIAKAD, lah UNJ ...";0;0;0;0;in;783478267;423221189427732480;YuliandreUan;https://twitter.com/YuliandreUan/status/423221189427732480
Tue Jan 14 22:31:18 +0000 2014;423220808601718785;"@BEMUNJ_OFFICIAL @BEM_JIAI @BEMFIS_UNJ pagi min.. Rektor baru ngga perlu janji lebih, cukup perbaiki siakad. Itu jauh lebih baik n berharga";0;0;3;0;in;783478267;423220808601718785;YuliandreUan;https://twitter.com/YuliandreUan/status/423220808601718785
Tue Jan 14 22:22:22 +0000 2014;423218559007735808;"Cuma siakad unj yang ngenes beb RT "@Chitrafebrina24: @LieArtha ih kalo bisa bilang yaaaah, dari kemaren2 nyeri hate beb, teu bisa2 dibuka";0;0;0;0;in;743504358;423218559007735808;LieArtha;https://twitter.com/LieArtha/status/423218559007735808
Tue Jan 14 21:34:22 +0000 2014;423206482654396416;"Iyak il, kalo di rumah bs gila buka siakad nye wakaka RT @IsmailMrzuki: Yoih mos, harus ke unj nih kayanya.. -__- RT @Ajieamri:";0;0;0;0;in;79167041;423206482654396416;mauiwowieman_;https://twitter.com/mauiwowieman_/status/423206482654396416
Tue Jan 14 21:31:22 +0000 2014;423205725548978176;"Tanda tangan petisi ini dong yg baik Hati â˜º Petisi | UNJ Tingkatkan performa SIAKAD http://t.co/sX5TmRuVJC http://t.co/jYIW59338n";0;0;0;0;in;457223186;423205725548978176;BelovedSyifa;https://twitter.com/BelovedSyifa/status/423205725548978176
Tue Jan 14 21:21:05 +0000 2014;423203137470492673;"#DearSiakad aku menunggumu dari tahun ke tahun sudah kelamaan. Tapi kamu tetap tiada perubahan. Jalur aksesmu tetap aja 'karatan' #SiakadUNJ";0;0;0;0;in;457223186;423203137470492673;BelovedSyifa;https://twitter.com/BelovedSyifa/status/423203137470492673
Tue Jan 14 21:18:36 +0000 2014;423202512024268800;"UNJ mahasiswanya ribuan. Dari banyak jurusan Nah dana yg didapet per tahunnya kan pasti besar pada kemana si betulin akses siakad aja enggaâ˜¹";0;0;0;0;in;457223186;423202512024268800;BelovedSyifa;https://twitter.com/BelovedSyifa/status/423202512024268800
Tue Jan 14 21:14:34 +0000 2014;423201498135146496;"Siakad unj ini dari tahun ke tahun ga pernah berubah tetep berkarat aja akses nya... #Hih gw tulis di @kompasiana. Juga nih lama-lamaâ˜¹";0;0;0;0;in;457223186;423201498135146496;BelovedSyifa;https://twitter.com/BelovedSyifa/status/423201498135146496
Tue Jan 14 18:16:13 +0000 2014;423156616385396736;"@doankdaniel gue bukain punya anak fik jg ada jadwalnya niel. Skrg kan jdwl kita yak? Mending lu ikut #dialogBaCaRek unj dah, protes siakad.";0;1;0;0;in;445447840;423154866450477057;nisank_;https://twitter.com/nisank_/status/423156616385396736
Tue Jan 14 18:26:21 +0000 2014;423159163636572160;"Maaf laman siakad unj tidak dapat diakses karena tidak sesuai dengan UU ITE RI";0;0;0;0;in;325424186;423159163636572160;Jamenisme;https://twitter.com/Jamenisme/status/423159163636572160
Tue Jan 14 19:35:36 +0000 2014;423176593393995776;"mau melatih atau melihat sudah sampai manakah kesabaran anda? silahkan buka siakad unj.. :"D";0;0;1;0;in;535966478;423176593393995776;vruhaa;https://twitter.com/vruhaa/status/423176593393995776
Tue Jan 14 18:14:28 +0000 2014;423156172573523968;"Siakad oh siakad.. Kamu bikin galau anak satu kampus :)";0;0;0;0;in;938467477;423156172573523968;JJLC_UNJ;https://twitter.com/JJLC_UNJ/status/423156172573523968
Tue Jan 14 17:50:51 +0000 2014;423150231929110528;"Siakad eror! | yaelah unj aje eror hahaha";0;0;0;0;in;359814502;423150231929110528;Chitrafebrina24;https://twitter.com/Chitrafebrina24/status/423150231929110528
Tue Jan 14 17:37:36 +0000 2014;423146895284776960;"UNJ kalo masalah buka siakad kayak orang susah, kelamaan n ribet . tot [pic] â€” https://t.co/QojyNIvzbo";0;0;0;0;in;299088396;423146895284776960;wahyujogerjelek;https://twitter.com/wahyujogerjelek/status/423146895284776960
Tue Jan 14 17:03:22 +0000 2014;423138281459441664;"Warga unj pliss kalian tidur yg nyenyak yaaah, jangan ada yg buka siakad. Biar gue aja yg buka ..";0;0;0;0;in;477689871;423138281459441664;rifcaCh;https://twitter.com/rifcaCh/status/423138281459441664
Tue Jan 14 16:53:45 +0000 2014;423135860964339712;"emg lo ngerti?wkwk RT @AsriSupriyanti Aduh temen-temenku yang di UNJ, gak yang di TL, di PM ngomongin siakad. Semangat ya semoga ipnya";0;1;0;0;in;406066815;423128325037363201;masmasfortuner;https://twitter.com/masmasfortuner/status/423135860964339712
Tue Jan 14 16:49:01 +0000 2014;423134669991714817;"@selviavivi itulah UNJ, mending benerin aja dulu siakad baru benerin gedung :(";0;1;0;0;in;2190106442;423133530256732161;diahputriayuu;https://twitter.com/diahputriayuu/status/423134669991714817
Tue Jan 14 16:25:44 +0000 2014;423128811966713856;"â€œ@CLisaR: sudahlah mungkin emang siakad diciptakan untuk menguji kesabaran mahasiswa UNJâ€ juara";0;0;0;0;in;1150954735;423127014237691904;well_while;https://twitter.com/well_while/status/423128811966713856
Tue Jan 14 15:07:37 +0000 2014;423109153905590272;"sudahhh "@bemjikk_unj: Selamat malam teman teman IKK. Gimana KRS dan KHS nya? Sudah ada yang bisa meluluhkan Siakad? :D"";0;0;0;0;in;77435333;423109153905590272;odimrf;https://twitter.com/odimrf/status/423109153905590272
Tue Jan 14 14:53:57 +0000 2014;423105713485783040;"Taat sama jadwal min 8) RT @bemjikk_unj: Selamat malam teman teman IKK. Gimana KRS dan KHS nya? Sudah ada yang bisa meluluhkan Siakad? :D";0;0;0;0;in;77214243;423105713485783040;diahelindar;https://twitter.com/diahelindar/status/423105713485783040
Tue Jan 14 14:50:54 +0000 2014;423104945731026944;"Selamat malam teman teman IKK. Gimana KRS dan KHS nya? Sudah ada yang bisa meluluhkan Siakad? :D";0;1;0;0;in;569159470;423104945731026944;bemjikk_unj;https://twitter.com/bemjikk_unj/status/423104945731026944
Tue Jan 14 13:55:53 +0000 2014;423091098345410561;"Cie maba yang di PHP-in SIAKAD --&gt  "@gregoriusandito: Perbedaan mendasar antara unj dengan universitas negeri lainnya: SIAKAD sulit diakses"";0;1;0;0;in;274995833;423091098345410561;theresia_venty;https://twitter.com/theresia_venty/status/423091098345410561
Tue Jan 14 12:31:31 +0000 2014;423069867399335936;"Amminnn RT @iienainggolan: Tuhan bersama mahasiswa FBS UNJ yang mau buka siakad tapi error terus. amin.";0;0;0;0;in;130064582;423069867399335936;mukliz_en;https://twitter.com/mukliz_en/status/423069867399335936
Tue Jan 14 12:00:48 +0000 2014;423062138576314369;"@fidowdidow iya kak kan siakad unj lemot banget dr dulu kkk";0;0;0;0;in;78886616;423058967049158656;nisa920810;https://twitter.com/nisa920810/status/423062138576314369
Tue Jan 14 11:44:16 +0000 2014;423057977650581504;"@asma_SN12 pftt tiap semester dibikin galau mulu heran #siakadunj";0;0;0;0;in;225478653;423034848790323200;nisahh_12;https://twitter.com/nisahh_12/status/423057977650581504
Tue Jan 14 11:31:31 +0000 2014;423054767800078336;"Terus aja phpin, liat aja pembalasanku! #SiakadUNJ";0;0;0;0;in;294133406;423054767800078336;esakhaosar;https://twitter.com/esakhaosar/status/423054767800078336
Tue Jan 14 11:26:11 +0000 2014;423053424561627136;"miris euy siakad unj ancur bgt";0;0;1;0;in;114468245;423053424561627136;adityaprtmaa;https://twitter.com/adityaprtmaa/status/423053424561627136
Tue Jan 14 11:20:04 +0000 2014;423051889073090560;"Tuhan bersama mahasiswa FBS UNJ yang mau buka siakad tapi error terus. amin.";0;0;0;0;in;45790767;423051889073090560;iienainggolan;https://twitter.com/iienainggolan/status/423051889073090560
Tue Jan 14 10:38:08 +0000 2014;423041333469511680;"Lagi lagi siakad bikin galau semua mahasiswa unj :(";0;0;1;0;in;91050283;423041333469511680;mariemaryam;https://twitter.com/mariemaryam/status/423041333469511680
Tue Jan 14 10:01:06 +0000 2014;423032014967562240;"Ini servernye siakad unj pake windows 98 ape gimane sik min? @MahasiswaUNJ";0;0;0;0;in;84549423;423032014967562240;fakhriraditya;https://twitter.com/fakhriraditya/status/423032014967562240
Tue Jan 14 09:54:14 +0000 2014;423030287853842432;"Udah ada yg berhasil buka siakad? Waktu mimin coba buka sih diomelin disuruh buka tgl 17,21,25,29 Januari 2014 jam 6 smpai 18.00";0;0;2;0;in;1279151222;423030287853842432;PLSFIP_UNJ;https://twitter.com/PLSFIP_UNJ/status/423030287853842432
Tue Jan 14 09:37:11 +0000 2014;423025997709983744;"Serius nih, bener #SiakadUNJ masih aja kayak hati gue gak mau move on-_-";0;0;1;0;in;459034670;423025997709983744;EldaSTambunan;https://twitter.com/EldaSTambunan/status/423025997709983744
Tue Jan 14 09:36:25 +0000 2014;423025802767126528;"Lupa pasword siakad :|,harus ke unj nih :(";0;1;0;0;in;1551851035;423025802767126528;aidafitria139;https://twitter.com/aidafitria139/status/423025802767126528
Tue Jan 14 09:36:12 +0000 2014;423025747758821376;"UNJ sepertinya tdk cocok sebagai penghasil Guru. Karna mengelola Siakad saja sudah kacau. Bagaimana mengelola otak muridnya kelak? :))";0;0;2;0;in;172927737;423025747758821376;Yogohars;https://twitter.com/Yogohars/status/423025747758821376
Tue Jan 14 09:22:56 +0000 2014;423022409097023489;"@MABA_UNJ min drtdi aku bka siakad,jwbanya"jdwal akses anda tgl 14,18,dst." tp kok mlah kmbali lg ke tmpilan awal ya?pdhal skrg bner tgl 14.";0;0;1;0;in;777191324;423022409097023489;FakhriaZulfa3;https://twitter.com/FakhriaZulfa3/status/423022409097023489
Tue Jan 14 08:46:13 +0000 2014;423013170072920064;"RT @nurilim: selamat siang @tpm_unj . Sy dr FBS tp ga bs log in ke siakad padahal hari ini jadwalnya. Terima kasih. http://t.co/Y8ljRB5AY9";0;1;0;0;in;109202444;423013170072920064;alinot;https://twitter.com/alinot/status/423013170072920064
Tue Jan 14 08:39:55 +0000 2014;423011583401291776;"selamat siang @tpm_unj . Sy dr FBS tp ga bs log in ke siakad padahal hari ini jadwalnya. Terima kasih. http://t.co/ugZLKcv4Zu";0;0;1;0;in;50251881;423011583401291776;nurilim;https://twitter.com/nurilim/status/423011583401291776
Tue Jan 14 07:16:46 +0000 2014;422990657032957952;"@MABA_UNJ minul.. gak bs buka siakad-_- padahal hari ini jadwal fakultas saya";0;0;0;0;in;109780389;422990657032957952;inaidzyr;https://twitter.com/inaidzyr/status/422990657032957952
Tue Jan 14 06:53:59 +0000 2014;422984923406807040;"Siakad UNJ gilaaaaaa'";0;0;0;0;in;1284778441;422984923406807040;orizatamara;https://twitter.com/orizatamara/status/422984923406807040
Tue Jan 14 06:19:23 +0000 2014;422976218649341953;"Mengapa siakad unj dari semster ke semster selalu tanpa perubahan yg ... â€” percuma ngkritik UNJ, gada yg mau denger http://t.co/aW5sT9g33t";0;0;0;0;in;135519062;422976218649341953;dymaspratama;https://twitter.com/dymaspratama/status/422976218649341953
Tue Jan 14 05:03:01 +0000 2014;422957000721301504;"sabar ya, @RiaVinola_minoz: siakad unj bikin greget u,u";0;0;0;0;in;1552821486;422957000721301504;indryolalaII;https://twitter.com/indryolalaII/status/422957000721301504
Tue Jan 14 03:51:45 +0000 2014;422939064698798080;"Ida @ida_NurHidayati nih RT @HMJ_TP_UNJ: "@bemfipunj: Jadwal akses siakad terbaru http://t.co/L3ATa5lc2j"";0;1;0;0;in;330366683;422939064698798080;segelasalmond;https://twitter.com/segelasalmond/status/422939064698798080
Tue Jan 14 03:17:40 +0000 2014;422930486743146497;"Wah kayaknya pada pusing sama siakad yah, mending pantengin TL kita dulu buat info-info menarik seputar CHARITY CONCERT #KonserAmal2014";0;0;1;0;in;856076682;422930486743146497;EventPsi_UNJ;https://twitter.com/EventPsi_UNJ/status/422930486743146497
Tue Jan 14 02:49:32 +0000 2014;422923407223574528;"Siakad unj emang media paling tepat buat menguji kesabaran (Â¯â€•Â¯Ù¥)";0;0;3;0;in;71243173;422923407223574528;fadilahaeni;https://twitter.com/fadilahaeni/status/422923407223574528
